root@comp3143Winter2025:~# tcpdump -n -i eth0
tcpdump: verbose output suppressed, use -v[v]... for full protocol decode
listening on eth0, link-type EN10MB (Ethernet), snapshot length 262144 bytes
20:52:17.001770 IP 138.197.173.235.22 > 45.145.155.4.31281: Flags [P.], seq 676067810:676067918, ack 3992152801, win 501, length 108
20:52:17.001868 IP 138.197.173.235.22 > 45.145.155.4.31281: Flags [P.], seq 108:196, ack 1, win 501, length 88
20:52:17.001916 IP 138.197.173.235.22 > 45.145.155.4.31281: Flags [P.], seq 196:332, ack 1, win 501, length 136
20:52:17.001945 IP 138.197.173.235.22 > 45.145.155.4.31281: Flags [P.], seq 332:368, ack 1, win 501, length 36
20:52:17.102888 IP 138.197.173.235.22 > 45.145.155.4.31281: Flags [P.], seq 368:540, ack 1, win 501, length 172
20:52:17.102971 IP 138.197.173.235.22 > 45.145.155.4.31281: Flags [P.], seq 540:576, ack 1, win 501, length 36
20:52:17.103004 IP 138.197.173.235.22 > 45.145.155.4.31281: Flags [P.], seq 576:724, ack 1, win 501, length 148
20:52:17.103032 IP 138.197.173.235.22 > 45.145.155.4.31281: Flags [P.], seq 724:760, ack 1, win 501, length 36
20:52:17.103069 IP 138.197.173.235.22 > 45.145.155.4.31281: Flags [P.], seq 760:908, ack 1, win 501, length 148
20:52:17.226784 IP 45.145.155.4.31281 > 138.197.173.235.22: Flags [.], ack 0, win 15358, length 0
20:52:17.226843 IP 138.197.173.235.22 > 45.145.155.4.31281: Flags [P.], seq 908:2048, ack 1, win 501, length 1140
20:52:17.232218 IP 45.145.155.4.31281 > 138.197.173.235.22: Flags [.], ack 108, win 15358, length 0
20:52:17.232218 IP 45.145.155.4.31281 > 138.197.173.235.22: Flags [.], ack 196, win 15358, length 0
20:52:17.232218 IP 45.145.155.4.31281 > 138.197.173.235.22: Flags [.], ack 332, win 15358, length 0
20:52:17.232403 IP 45.145.155.4.31281 > 138.197.173.235.22: Flags [.], ack 368, win 15358, length 0
20:52:17.310771 IP 138.197.173.235.22 > 45.145.155.4.31281: Flags [P.], seq 2048:2180, ack 1, win 501, length 132
20:52:17.310895 IP 138.197.173.235.22 > 45.145.155.4.31281: Flags [P.], seq 2180:2216, ack 1, win 501, length 36
20:52:17.310944 IP 138.197.173.235.22 > 45.145.155.4.31281: Flags [P.], seq 2216:2364, ack 1, win 501, length 148
20:52:17.310982 IP 138.197.173.235.22 > 45.145.155.4.31281: Flags [P.], seq 2364:2400, ack 1, win 501, length 36
20:52:17.331147 IP 45.145.155.4.31281 > 138.197.173.235.22: Flags [.], ack 540, win 15358, length 0
20:52:17.331222 IP 138.197.173.235.22 > 45.145.155.4.31281: Flags [P.], seq 2400:3104, ack 1, win 501, length 704
20:52:17.331270 IP 45.145.155.4.31281 > 138.197.173.235.22: Flags [.], ack 576, win 15358, length 0
20:52:17.331366 IP 45.145.155.4.31281 > 138.197.173.235.22: Flags [.], ack 724, win 15358, length 0
20:52:17.331366 IP 45.145.155.4.31281 > 138.197.173.235.22: Flags [.], ack 760, win 15358, length 0
20:52:17.331366 IP 45.145.155.4.31281 > 138.197.173.235.22: Flags [.], ack 908, win 15358, length 0
20:52:17.414759 IP 138.197.173.235.22 > 45.145.155.4.31281: Flags [P.], seq 3104:3252, ack 1, win 501, length 148
20:52:17.414836 IP 138.197.173.235.22 > 45.145.155.4.31281: Flags [P.], seq 3252:3436, ack 1, win 501, length 184
20:52:17.414876 IP 138.197.173.235.22 > 45.145.155.4.31281: Flags [P.], seq 3436:3472, ack 1, win 501, length 36
20:52:17.414913 IP 138.197.173.235.22 > 45.145.155.4.31281: Flags [P.], seq 3472:3620, ack 1, win 501, length 148
20:52:17.456477 IP 45.145.155.4.31281 > 138.197.173.235.22: Flags [.], ack 2048, win 15358, length 0
20:52:17.456540 IP 138.197.173.235.22 > 45.145.155.4.31281: Flags [P.], seq 3620:4904, ack 1, win 501, length 1284
20:52:17.543155 IP 45.145.155.4.31281 > 138.197.173.235.22: Flags [.], ack 2180, win 15358, length 0
20:52:17.543217 IP 138.197.173.235.22 > 45.145.155.4.31281: Flags [P.], seq 4904:6000, ack 1, win 501, length 1096
20:52:17.543348 IP 45.145.155.4.31281 > 138.197.173.235.22: Flags [.], ack 2216, win 15358, length 0
20:52:17.543348 IP 45.145.155.4.31281 > 138.197.173.235.22: Flags [.], ack 2364, win 15358, length 0
20:52:17.543374 IP 45.145.155.4.31281 > 138.197.173.235.22: Flags [.], ack 2400, win 15358, length 0
20:52:17.558555 IP 138.197.173.235.22 > 116.110.71.138.38980: Flags [P.], seq 2854973766:2854974920, ack 937446711, win 509, options [nop,nop,TS val 669727672 ecr 2037703019], length 1154: SSH: SSH-2.0-OpenSSH_8.9p1 Ubuntu-3ubuntu0.10
20:52:17.560033 IP 45.145.155.4.31281 > 138.197.173.235.22: Flags [.], ack 3104, win 15358, length 0
20:52:17.622679 IP 138.197.173.235.22 > 45.145.155.4.31281: Flags [P.], seq 6000:6140, ack 1, win 501, length 140
20:52:17.622754 IP 138.197.173.235.22 > 45.145.155.4.31281: Flags [P.], seq 6140:6176, ack 1, win 501, length 36
20:52:17.622789 IP 138.197.173.235.22 > 45.145.155.4.31281: Flags [P.], seq 6176:6324, ack 1, win 501, length 148
20:52:17.622817 IP 138.197.173.235.22 > 45.145.155.4.31281: Flags [P.], seq 6324:6360, ack 1, win 501, length 36
20:52:17.644045 IP 45.145.155.4.31281 > 138.197.173.235.22: Flags [.], ack 3620, win 15358, length 0
20:52:17.644105 IP 138.197.173.235.22 > 45.145.155.4.31281: Flags [P.], seq 6360:7368, ack 1, win 501, length 1008
20:52:17.688802 IP 45.145.155.4.31281 > 138.197.173.235.22: Flags [.], ack 4904, win 15358, length 0
20:52:17.726791 IP 138.197.173.235.22 > 45.145.155.4.31281: Flags [P.], seq 7368:8180, ack 1, win 501, length 812
20:52:17.771391 IP 45.145.155.4.31281 > 138.197.173.235.22: Flags [.], ack 6000, win 15358, length 0
20:52:17.779749 IP 138.197.173.235.22 > 203.83.233.37.42892: Flags [P.], seq 4238748475:4238748527, ack 48698362, win 501, options [nop,nop,TS val 2589498968 ecr 2784508423], length 52
20:52:17.830821 IP 138.197.173.235.22 > 45.145.155.4.31281: Flags [P.], seq 8180:8624, ack 1, win 501, length 444
20:52:17.850852 IP 45.145.155.4.31281 > 138.197.173.235.22: Flags [.], ack 6140, win 15358, length 0
20:52:17.850907 IP 45.145.155.4.31281 > 138.197.173.235.22: Flags [.], ack 6360, win 15358, length 0
20:52:17.872239 IP 45.145.155.4.31281 > 138.197.173.235.22: Flags [.], ack 7368, win 15358, length 0
20:52:17.934799 IP 138.197.173.235.22 > 45.145.155.4.31281: Flags [P.], seq 8624:9084, ack 1, win 501, length 460
20:52:17.954930 IP 45.145.155.4.31281 > 138.197.173.235.22: Flags [.], ack 8180, win 15358, length 0
20:52:17.994856 IP 203.83.233.37.42892 > 138.197.173.235.22: Flags [F.], seq 1, ack 52, win 269, options [nop,nop,TS val 2784512068 ecr 2589498968], length 0
20:52:17.996321 IP 138.197.173.235.22 > 203.83.233.37.42892: Flags [F.], seq 52, ack 2, win 501, options [nop,nop,TS val 2589499184 ecr 2784512068], length 0
20:52:18.009111 IP 203.83.233.37.46614 > 138.197.173.235.22: Flags [S], seq 3974780818, win 29200, options [mss 1460,sackOK,TS val 2784512068 ecr 0,nop,wscale 7], length 0
20:52:18.009186 IP 138.197.173.235.22 > 203.83.233.37.46614: Flags [S.], seq 2190259887, ack 3974780819, win 65160, options [mss 1460,sackOK,TS val 2589499197 ecr 2784512068,nop,wscale 7], length 0
20:52:18.038848 IP 138.197.173.235.22 > 45.145.155.4.31281: Flags [P.], seq 9084:10032, ack 1, win 501, length 948
20:52:18.058894 IP 45.145.155.4.31281 > 138.197.173.235.22: Flags [.], ack 8624, win 15358, length 0
20:52:18.142717 IP 138.197.173.235.22 > 45.145.155.4.31281: Flags [P.], seq 10032:10284, ack 1, win 501, length 252
20:52:18.162953 IP 45.145.155.4.31281 > 138.197.173.235.22: Flags [.], ack 9084, win 15358, length 0
20:52:18.211174 IP 45.142.193.106.52624 > 138.197.173.235.2133: Flags [S], seq 3563546019, win 1024, length 0
20:52:18.211396 IP 203.83.233.37.42892 > 138.197.173.235.22: Flags [.], ack 53, win 269, options [nop,nop,TS val 2784512285 ecr 2589499184], length 0
20:52:18.239643 IP 203.83.233.37.46614 > 138.197.173.235.22: Flags [.], ack 1, win 229, options [nop,nop,TS val 2784512299 ecr 2589499197], length 0
20:52:18.246704 IP 138.197.173.235.22 > 45.145.155.4.31281: Flags [P.], seq 10284:10952, ack 1, win 501, length 668
20:52:18.250938 IP 138.197.173.235.22 > 203.83.233.37.46614: Flags [P.], seq 1:43, ack 1, win 510, options [nop,nop,TS val 2589499439 ecr 2784512299], length 42: SSH: SSH-2.0-OpenSSH_8.9p1 Ubuntu-3ubuntu0.10
20:52:18.263013 IP 203.83.233.37.46614 > 138.197.173.235.22: Flags [P.], seq 1:13, ack 1, win 229, options [nop,nop,TS val 2784512322 ecr 2589499197], length 12: SSH: SSH-2.0-Go
20:52:18.263078 IP 138.197.173.235.22 > 203.83.233.37.46614: Flags [.], ack 13, win 510, options [nop,nop,TS val 2589499451 ecr 2784512322], length 0
20:52:18.267306 IP 45.145.155.4.31281 > 138.197.173.235.22: Flags [.], ack 10032, win 15358, length 0
20:52:18.350778 IP 138.197.173.235.22 > 45.145.155.4.31281: Flags [P.], seq 10952:11748, ack 1, win 501, length 796
20:52:18.374933 IP 45.145.155.4.31281 > 138.197.173.235.22: Flags [.], ack 10284, win 15358, length 0
20:52:18.454772 IP 138.197.173.235.22 > 45.145.155.4.31281: Flags [P.], seq 11748:12008, ack 1, win 501, length 260
20:52:18.475382 IP 45.145.155.4.31281 > 138.197.173.235.22: Flags [.], ack 10952, win 15358, length 0
20:52:18.481310 IP 203.83.233.37.46614 > 138.197.173.235.22: Flags [.], ack 43, win 229, options [nop,nop,TS val 2784512541 ecr 2589499439], length 0
20:52:18.481365 IP 138.197.173.235.22 > 203.83.233.37.46614: Flags [P.], seq 43:1155, ack 13, win 510, options [nop,nop,TS val 2589499669 ecr 2784512541], length 1112
20:52:18.499995 IP 203.83.233.37.46614 > 138.197.173.235.22: Flags [P.], seq 13:1101, ack 43, win 229, options [nop,nop,TS val 2784512559 ecr 2589499451], length 1088
20:52:18.500074 IP 138.197.173.235.22 > 203.83.233.37.46614: Flags [.], ack 1101, win 502, options [nop,nop,TS val 2589499688 ecr 2784512559], length 0
20:52:18.558815 IP 138.197.173.235.22 > 45.145.155.4.31281: Flags [P.], seq 12008:12908, ack 1, win 501, length 900
20:52:18.561205 IP 45.142.193.106.52624 > 138.197.173.235.40830: Flags [S], seq 953325264, win 1024, length 0
20:52:18.579477 IP 45.145.155.4.31281 > 138.197.173.235.22: Flags [.], ack 11748, win 15358, length 0
20:52:18.662785 IP 138.197.173.235.22 > 45.145.155.4.31281: Flags [P.], seq 12908:13280, ack 1, win 501, length 372
20:52:18.683320 IP 45.145.155.4.31281 > 138.197.173.235.22: Flags [.], ack 12008, win 15358, length 0
20:52:18.731835 IP 203.83.233.37.46614 > 138.197.173.235.22: Flags [P.], seq 1101:1149, ack 1155, win 251, options [nop,nop,TS val 2784512791 ecr 2589499669], length 48
20:52:18.731904 IP 138.197.173.235.22 > 203.83.233.37.46614: Flags [.], ack 1149, win 502, options [nop,nop,TS val 2589499920 ecr 2784512791], length 0
20:52:18.736881 IP 138.197.173.235.22 > 203.83.233.37.46614: Flags [P.], seq 1155:1759, ack 1149, win 502, options [nop,nop,TS val 2589499925 ecr 2784512791], length 604
20:52:18.766794 IP 138.197.173.235.22 > 45.145.155.4.31281: Flags [P.], seq 13280:14028, ack 1, win 501, length 748
20:52:18.786929 IP 45.145.155.4.31281 > 138.197.173.235.22: Flags [.], ack 12908, win 15358, length 0
20:52:18.870794 IP 138.197.173.235.22 > 45.145.155.4.31281: Flags [P.], seq 14028:14288, ack 1, win 501, length 260
20:52:18.895898 IP 45.145.155.4.31281 > 138.197.173.235.22: Flags [.], ack 13280, win 15358, length 0
20:52:18.970999 IP 203.83.233.37.46614 > 138.197.173.235.22: Flags [P.], seq 1149:1165, ack 1759, win 269, options [nop,nop,TS val 2784513030 ecr 2589499925], length 16
20:52:18.970999 IP 203.83.233.37.46614 > 138.197.173.235.22: Flags [P.], seq 1165:1217, ack 1759, win 269, options [nop,nop,TS val 2784513030 ecr 2589499925], length 52
20:52:18.971096 IP 138.197.173.235.22 > 203.83.233.37.46614: Flags [.], ack 1217, win 502, options [nop,nop,TS val 2589500159 ecr 2784513030], length 0
20:52:18.971192 IP 138.197.173.235.22 > 203.83.233.37.46614: Flags [P.], seq 1759:1811, ack 1217, win 502, options [nop,nop,TS val 2589500159 ecr 2784513030], length 52
20:52:18.974810 IP 138.197.173.235.22 > 45.145.155.4.31281: Flags [P.], seq 14288:15212, ack 1, win 501, length 924
20:52:18.995641 IP 45.145.155.4.31281 > 138.197.173.235.22: Flags [.], ack 14028, win 15358, length 0
20:52:19.078801 IP 138.197.173.235.22 > 45.145.155.4.31281: Flags [P.], seq 15212:15472, ack 1, win 501, length 260
20:52:19.099558 IP 45.145.155.4.31281 > 138.197.173.235.22: Flags [.], ack 14288, win 15358, length 0
20:52:19.182802 IP 138.197.173.235.22 > 45.145.155.4.31281: Flags [P.], seq 15472:15732, ack 1, win 501, length 260
20:52:19.190556 IP 138.197.173.235.22 > 116.110.71.138.46740: Flags [P.], seq 3898461982:3898462506, ack 763497723, win 501, options [nop,nop,TS val 669729304 ecr 2037696939], length 524
20:52:19.206171 IP 45.145.155.4.31281 > 138.197.173.235.22: Flags [.], ack 15212, win 15358, length 0
20:52:19.219294 IP 203.83.233.37.46614 > 138.197.173.235.22: Flags [P.], seq 1217:1285, ack 1811, win 269, options [nop,nop,TS val 2784513278 ecr 2589500159], length 68
20:52:19.226332 IP 138.197.173.235.22 > 203.83.233.37.46614: Flags [P.], seq 1811:1863, ack 1285, win 502, options [nop,nop,TS val 2589500414 ecr 2784513278], length 52
20:52:19.286769 IP 138.197.173.235.22 > 45.145.155.4.31281: Flags [P.], seq 15732:16520, ack 1, win 501, length 788
20:52:19.307429 IP 45.145.155.4.31281 > 138.197.173.235.22: Flags [.], ack 15472, win 15358, length 0
20:52:19.390795 IP 138.197.173.235.22 > 45.145.155.4.31281: Flags [P.], seq 16520:16780, ack 1, win 501, length 260
20:52:19.411434 IP 45.145.155.4.31281 > 138.197.173.235.22: Flags [.], ack 15732, win 15358, length 0
20:52:19.438794 IP 116.110.71.138.46740 > 138.197.173.235.22: Flags [.], ack 524, win 501, options [nop,nop,TS val 2037707104 ecr 669729304], length 0
20:52:19.459137 IP 203.83.233.37.46614 > 138.197.173.235.22: Flags [P.], seq 1285:1369, ack 1863, win 269, options [nop,nop,TS val 2784513518 ecr 2589500414], length 84
20:52:19.494712 IP 138.197.173.235.22 > 45.145.155.4.31281: Flags [P.], seq 16780:17360, ack 1, win 501, length 580
20:52:19.502528 IP 138.197.173.235.22 > 203.83.233.37.46614: Flags [.], ack 1369, win 502, options [nop,nop,TS val 2589500691 ecr 2784513518], length 0
20:52:19.517877 IP 45.145.155.4.31281 > 138.197.173.235.22: Flags [.], ack 16520, win 15358, length 0
20:52:19.598805 IP 138.197.173.235.22 > 45.145.155.4.31281: Flags [P.], seq 17360:17772, ack 1, win 501, length 412
20:52:19.619894 IP 45.145.155.4.31281 > 138.197.173.235.22: Flags [.], ack 16780, win 15358, length 0
20:52:19.702726 IP 138.197.173.235.22 > 45.145.155.4.31281: Flags [P.], seq 17772:18032, ack 1, win 501, length 260
20:52:19.706775 IP 45.142.193.106.52624 > 138.197.173.235.2124: Flags [S], seq 2722172130, win 1024, length 0
20:52:19.723340 IP 45.145.155.4.31281 > 138.197.173.235.22: Flags [.], ack 17360, win 15358, length 0
20:52:19.806808 IP 138.197.173.235.22 > 45.145.155.4.31281: Flags [P.], seq 18032:18404, ack 1, win 501, length 372
20:52:19.826875 IP 45.145.155.4.31281 > 138.197.173.235.22: Flags [.], ack 17772, win 15358, length 0
20:52:19.910813 IP 138.197.173.235.22 > 45.145.155.4.31281: Flags [P.], seq 18404:18664, ack 1, win 501, length 260
20:52:19.930874 IP 45.145.155.4.31281 > 138.197.173.235.22: Flags [.], ack 18032, win 15358, length 0
20:52:20.014779 IP 138.197.173.235.22 > 45.145.155.4.31281: Flags [P.], seq 18664:18924, ack 1, win 501, length 260
20:52:20.036090 IP 45.145.155.4.31281 > 138.197.173.235.22: Flags [.], ack 18404, win 15358, length 0
^C
123 packets captured
127 packets received by filter
0 packets dropped by kernel
root@comp3143Winter2025:~# 
