tcpdump: verbose output suppressed, use -v[v]... for full protocol decode
listening on eth0, link-type EN10MB (Ethernet), snapshot length 262144 bytes
20:41:18.613556 IP comp3143Winter2025.ssh > 45.145.155.4.31281: Flags [P.], seq 662098038:662098146, ack 3992141613, win 501, length 108
20:41:18.613625 IP comp3143Winter2025.ssh > 45.145.155.4.31281: Flags [P.], seq 108:144, ack 1, win 501, length 36
20:41:18.613645 IP comp3143Winter2025.ssh > 45.145.155.4.31281: Flags [P.], seq 144:196, ack 1, win 501, length 52
20:41:18.613672 IP comp3143Winter2025.ssh > 45.145.155.4.31281: Flags [P.], seq 196:264, ack 1, win 501, length 68
20:41:18.613702 IP comp3143Winter2025.ssh > 45.145.155.4.31281: Flags [P.], seq 264:332, ack 1, win 501, length 68
20:41:18.613729 IP comp3143Winter2025.ssh > 45.145.155.4.31281: Flags [P.], seq 332:368, ack 1, win 501, length 36
20:41:18.712220 IP comp3143Winter2025.45779 > 67.207.67.2.domain: 13893+ [1au] PTR? 4.155.145.45.in-addr.arpa. (54)
20:41:18.712335 IP comp3143Winter2025.37758 > 67.207.67.2.domain: 714+ [1au] PTR? 4.155.145.45.in-addr.arpa. (54)
20:41:18.730041 IP 67.207.67.2.domain > comp3143Winter2025.45779: 13893 NXDomain 0/1/1 (108)
20:41:18.730344 IP comp3143Winter2025.45779 > 67.207.67.2.domain: 13893+ PTR? 4.155.145.45.in-addr.arpa. (43)
20:41:18.745074 IP 67.207.67.2.domain > comp3143Winter2025.37758: 714 NXDomain 0/1/1 (108)
20:41:18.745259 IP comp3143Winter2025.37758 > 67.207.67.2.domain: 714+ PTR? 4.155.145.45.in-addr.arpa. (43)
20:41:18.747181 IP 67.207.67.2.domain > comp3143Winter2025.37758: 714 NXDomain 0/1/0 (97)
20:41:18.747650 IP 67.207.67.2.domain > comp3143Winter2025.45779: 13893 NXDomain 0/1/0 (97)
20:41:18.832916 IP 45.145.155.4.31281 > comp3143Winter2025.ssh: Flags [.], ack 0, win 330, length 0
20:41:18.845347 IP 45.145.155.4.31281 > comp3143Winter2025.ssh: Flags [.], ack 108, win 330, length 0
20:41:18.845347 IP 45.145.155.4.31281 > comp3143Winter2025.ssh: Flags [.], ack 144, win 330, length 0
20:41:18.845347 IP 45.145.155.4.31281 > comp3143Winter2025.ssh: Flags [.], ack 196, win 330, length 0
20:41:18.845437 IP 45.145.155.4.31281 > comp3143Winter2025.ssh: Flags [.], ack 264, win 330, length 0
20:41:18.845437 IP 45.145.155.4.31281 > comp3143Winter2025.ssh: Flags [.], ack 332, win 330, length 0
20:41:18.845437 IP 45.145.155.4.31281 > comp3143Winter2025.ssh: Flags [.], ack 368, win 330, length 0
20:41:19.194141 IP 45.142.193.106.52624 > comp3143Winter2025.58761: Flags [S], seq 4204997505, win 1024, length 0
20:41:19.669604 IP 45.142.193.106.52624 > comp3143Winter2025.55910: Flags [S], seq 4163261680, win 1024, length 0
20:41:19.741024 IP 103.252.137.102.37526 > comp3143Winter2025.ssh: Flags [S], seq 535876411, win 29200, options [mss 1460,sackOK,TS val 1876846343 ecr 0,nop,wscale 7], length 0
20:41:19.741115 IP comp3143Winter2025.ssh > 103.252.137.102.37526: Flags [S.], seq 2004537749, ack 535876412, win 65160, options [mss 1460,sackOK,TS val 4042714954 ecr 1876846343,nop,wscale 7], length 0
20:41:19.948068 IP 103.252.137.102.37526 > comp3143Winter2025.ssh: Flags [.], ack 1, win 229, options [nop,nop,TS val 1876846550 ecr 4042714954], length 0
20:41:19.959738 IP comp3143Winter2025.ssh > 103.252.137.102.37526: Flags [P.], seq 1:43, ack 1, win 510, options [nop,nop,TS val 4042715173 ecr 1876846550], length 42: SSH: SSH-2.0-OpenSSH_8.9p1 Ubuntu-3ubuntu0.10
20:41:20.166195 IP 103.252.137.102.37526 > comp3143Winter2025.ssh: Flags [.], ack 43, win 229, options [nop,nop,TS val 1876846769 ecr 4042715173], length 0
20:41:24.877047 IP comp3143Winter2025.ssh > 45.145.155.4.31281: Flags [P.], seq 368:1124, ack 1, win 501, length 756
20:41:24.877308 IP comp3143Winter2025.60253 > 67.207.67.2.domain: 34586+ [1au] PTR? 2.67.207.67.in-addr.arpa. (53)
20:41:24.877559 IP comp3143Winter2025.50215 > 67.207.67.2.domain: 57883+ [1au] PTR? 2.67.207.67.in-addr.arpa. (53)
20:41:24.878855 IP 67.207.67.2.domain > comp3143Winter2025.60253: 34586 NXDomain 0/1/1 (120)
20:41:24.878855 IP 67.207.67.2.domain > comp3143Winter2025.50215: 57883 NXDomain 0/1/1 (120)
20:41:24.879343 IP comp3143Winter2025.60253 > 67.207.67.2.domain: 34586+ PTR? 2.67.207.67.in-addr.arpa. (42)
20:41:24.879420 IP comp3143Winter2025.50215 > 67.207.67.2.domain: 57883+ PTR? 2.67.207.67.in-addr.arpa. (42)
20:41:24.880589 IP 67.207.67.2.domain > comp3143Winter2025.50215: 57883 NXDomain 0/1/0 (109)
20:41:24.880589 IP 67.207.67.2.domain > comp3143Winter2025.60253: 34586 NXDomain 0/1/0 (109)
20:41:24.917947 IP 103.252.137.102.37526 > comp3143Winter2025.ssh: Flags [R.], seq 1133, ack 1155, win 251, options [nop,nop,TS val 1876851514 ecr 4042717277], length 0
20:41:31.000284 IP comp3143Winter2025.ssh > 45.145.155.4.31281: Flags [P.], seq 1124:2704, ack 1, win 501, length 1580
20:41:31.000567 IP comp3143Winter2025.59395 > 67.207.67.2.domain: 19632+ [1au] PTR? 106.193.142.45.in-addr.arpa. (56)
20:41:31.000677 IP comp3143Winter2025.38087 > 67.207.67.2.domain: 42800+ [1au] PTR? 106.193.142.45.in-addr.arpa. (56)
20:41:31.000719 IP comp3143Winter2025.55814 > 67.207.67.2.domain: Flags [S], seq 1700927318, win 64240, options [mss 1460,sackOK,TS val 1150008773 ecr 0,nop,wscale 7,tfo  cookiereq,nop,nop], length 0
20:41:31.001609 IP 67.207.67.2.domain > comp3143Winter2025.59395: 19632 NXDomain 0/1/1 (110)
20:41:31.001810 IP 67.207.67.2.domain > comp3143Winter2025.38087: 42800 NXDomain 0/1/1 (110)
20:41:31.001904 IP comp3143Winter2025.59395 > 67.207.67.2.domain: 19632+ PTR? 106.193.142.45.in-addr.arpa. (45)
20:41:31.001978 IP comp3143Winter2025.38087 > 67.207.67.2.domain: 42800+ PTR? 106.193.142.45.in-addr.arpa. (45)
20:41:31.003101 IP 67.207.67.2.domain > comp3143Winter2025.59395: 19632 NXDomain 0/1/0 (99)
20:41:31.003275 IP 67.207.67.2.domain > comp3143Winter2025.55814: Flags [S.], seq 3366651769, ack 1700927319, win 65160, options [mss 1460,sackOK,TS val 4170486292 ecr 1150008773,nop,wscale 9], length 0
20:41:31.003318 IP comp3143Winter2025.55814 > 67.207.67.2.domain: Flags [.], ack 1, win 502, options [nop,nop,TS val 1150008775 ecr 4170486292], length 0
20:41:31.003353 IP comp3143Winter2025.55814 > 67.207.67.2.domain: Flags [P.], seq 1:48, ack 1, win 502, options [nop,nop,TS val 1150008775 ecr 4170486292], length 47 51504+ PTR? 106.193.142.45.in-addr.arpa. (45)
20:41:31.003569 IP 67.207.67.2.domain > comp3143Winter2025.38087: 42800 NXDomain 0/1/0 (99)
20:41:31.004598 IP 67.207.67.2.domain > comp3143Winter2025.55814: Flags [.], ack 48, win 128, options [nop,nop,TS val 4170486294 ecr 1150008775], length 0
20:41:31.004756 IP 67.207.67.2.domain > comp3143Winter2025.55814: Flags [P.], seq 1:102, ack 48, win 128, options [nop,nop,TS val 4170486294 ecr 1150008775], length 101 51504 NXDomain 0/1/0 (99)
20:41:31.004771 IP comp3143Winter2025.55814 > 67.207.67.2.domain: Flags [.], ack 102, win 502, options [nop,nop,TS val 1150008777 ecr 4170486294], length 0
20:41:31.005387 IP comp3143Winter2025.ssh > 45.145.155.4.31281: Flags [P.], seq 2704:2972, ack 1, win 501, length 268
20:41:31.005649 IP comp3143Winter2025.34759 > 67.207.67.2.domain: 11303+ [1au] PTR? 102.137.252.103.in-addr.arpa. (57)
20:41:31.005719 IP comp3143Winter2025.38180 > 67.207.67.2.domain: 27667+ [1au] PTR? 102.137.252.103.in-addr.arpa. (57)
20:41:31.005748 IP comp3143Winter2025.55814 > 67.207.67.2.domain: Flags [P.], seq 48:96, ack 102, win 502, options [nop,nop,TS val 1150008778 ecr 4170486294], length 48 44064+ PTR? 102.137.252.103.in-addr.arpa. (46)
20:41:31.007196 IP 67.207.67.2.domain > comp3143Winter2025.55814: Flags [P.], seq 102:238, ack 96, win 128, options [nop,nop,TS val 4170486297 ecr 1150008778], length 136 44064 NXDomain 0/1/0 (134)
20:41:31.007328 IP 67.207.67.2.domain > comp3143Winter2025.38180: 27667 NXDomain 0/1/1 (145)
20:41:31.007395 IP comp3143Winter2025.38180 > 67.207.67.2.domain: 27667+ PTR? 102.137.252.103.in-addr.arpa. (46)
20:41:31.007697 IP 67.207.67.2.domain > comp3143Winter2025.34759: 11303 NXDomain 0/1/1 (145)
20:41:31.007852 IP comp3143Winter2025.34759 > 67.207.67.2.domain: 11303+ PTR? 102.137.252.103.in-addr.arpa. (46)
20:41:31.008634 IP 67.207.67.2.domain > comp3143Winter2025.38180: 27667 NXDomain 0/1/0 (134)
20:41:31.008995 IP 67.207.67.2.domain > comp3143Winter2025.34759: 11303 NXDomain 0/1/0 (134)
20:41:31.009712 IP comp3143Winter2025.ssh > 45.145.155.4.31281: Flags [P.], seq 2972:5032, ack 1, win 501, length 2060
20:41:31.050542 IP comp3143Winter2025.55814 > 67.207.67.2.domain: Flags [.], ack 238, win 501, options [nop,nop,TS val 1150008823 ecr 4170486297], length 0
20:41:31.103504 IP comp3143Winter2025.ssh > 45.145.155.4.31281: Flags [P.], seq 5032:7952, ack 1, win 501, length 2920
20:41:31.103532 IP comp3143Winter2025.ssh > 45.145.155.4.31281: Flags [P.], seq 7952:8964, ack 1, win 501, length 1012
20:41:31.206776 IP comp3143Winter2025.ssh > 45.145.155.4.31281: Flags [P.], seq 8964:9240, ack 1, win 501, length 276
20:41:31.227128 IP comp3143Winter2025.ssh > 103.180.177.5.56368: Flags [P.], seq 2611875482:2611875534, ack 3478780327, win 501, options [nop,nop,TS val 1172723091 ecr 2672111212], length 52
20:41:31.228763 IP 45.145.155.4.31281 > comp3143Winter2025.ssh: Flags [.], ack 2584, win 325, length 0
20:41:31.228763 IP 45.145.155.4.31281 > comp3143Winter2025.ssh: Flags [.], ack 2704, win 325, length 0
20:41:31.234365 IP 45.145.155.4.31281 > comp3143Winter2025.ssh: Flags [.], ack 2972, win 325, length 0
20:41:31.238620 IP 45.145.155.4.31281 > comp3143Winter2025.ssh: Flags [.], ack 4432, win 325, length 0
20:41:31.238620 IP 45.145.155.4.31281 > comp3143Winter2025.ssh: Flags [.], ack 5032, win 325, length 0
20:41:31.246614 IP 116.110.71.138.38062 > comp3143Winter2025.ssh: Flags [P.], seq 432584302:432584338, ack 1770174643, win 501, options [nop,nop,TS val 2037058894 ecr 669080410], length 36
20:41:31.246615 IP 116.110.71.138.38062 > comp3143Winter2025.ssh: Flags [P.], seq 36:96, ack 1, win 501, options [nop,nop,TS val 2037058895 ecr 669080410], length 60
20:41:31.246714 IP comp3143Winter2025.ssh > 116.110.71.138.38062: Flags [.], ack 96, win 501, options [nop,nop,TS val 669081360 ecr 2037058894], length 0
20:41:31.253831 IP comp3143Winter2025.ssh > 116.110.71.138.38062: Flags [P.], seq 1:53, ack 96, win 501, options [nop,nop,TS val 669081367 ecr 2037058894], length 52
20:41:31.311073 IP comp3143Winter2025.ssh > 45.145.155.4.31281: Flags [P.], seq 9240:9396, ack 1, win 501, length 156
20:41:31.311477 IP comp3143Winter2025.41620 > 67.207.67.2.domain: 51504+ [1au] PTR? 5.177.180.103.in-addr.arpa. (55)
20:41:31.311580 IP comp3143Winter2025.58294 > 67.207.67.2.domain: 36995+ [1au] PTR? 5.177.180.103.in-addr.arpa. (55)
20:41:31.311630 IP comp3143Winter2025.55814 > 67.207.67.2.domain: Flags [P.], seq 96:142, ack 238, win 501, options [nop,nop,TS val 1150009084 ecr 4170486297], length 46 6375+ PTR? 5.177.180.103.in-addr.arpa. (44)
20:41:31.312640 IP 67.207.67.2.domain > comp3143Winter2025.41620: 51504 NXDomain 0/1/1 (143)
20:41:31.312691 IP 67.207.67.2.domain > comp3143Winter2025.58294: 36995 NXDomain 0/1/1 (143)
20:41:31.312894 IP 67.207.67.2.domain > comp3143Winter2025.55814: Flags [P.], seq 238:372, ack 142, win 128, options [nop,nop,TS val 4170486602 ecr 1150009084], length 134 6375 NXDomain 0/1/0 (132)
20:41:31.312926 IP comp3143Winter2025.55814 > 67.207.67.2.domain: Flags [.], ack 372, win 501, options [nop,nop,TS val 1150009085 ecr 4170486602], length 0
20:41:31.312947 IP comp3143Winter2025.41620 > 67.207.67.2.domain: 51504+ PTR? 5.177.180.103.in-addr.arpa. (44)
20:41:31.313023 IP comp3143Winter2025.58294 > 67.207.67.2.domain: 36995+ PTR? 5.177.180.103.in-addr.arpa. (44)
20:41:31.314148 IP 67.207.67.2.domain > comp3143Winter2025.58294: 36995 NXDomain 0/1/0 (132)
20:41:31.314148 IP 67.207.67.2.domain > comp3143Winter2025.41620: 51504 NXDomain 0/1/0 (132)
20:41:31.314929 IP comp3143Winter2025.ssh > 45.145.155.4.31281: Flags [P.], seq 9396:10144, ack 1, win 501, length 748
20:41:31.315305 IP comp3143Winter2025.37966 > 67.207.67.2.domain: 30490+ [1au] PTR? 138.71.110.116.in-addr.arpa. (56)
20:41:31.315407 IP comp3143Winter2025.44998 > 67.207.67.2.domain: 6916+ [1au] PTR? 138.71.110.116.in-addr.arpa. (56)
20:41:31.315438 IP comp3143Winter2025.55814 > 67.207.67.2.domain: Flags [P.], seq 142:189, ack 372, win 501, options [nop,nop,TS val 1150009087 ecr 4170486602], length 47 28583+ PTR? 138.71.110.116.in-addr.arpa. (45)
20:41:31.317317 IP 67.207.67.2.domain > comp3143Winter2025.55814: Flags [P.], seq 372:419, ack 189, win 128, options [nop,nop,TS val 4170486607 ecr 1150009087], length 47 28583 0/0/0 (45)
20:41:31.317756 IP comp3143Winter2025.ssh > 45.145.155.4.31281: Flags [P.], seq 10144:10860, ack 1, win 501, length 716
20:41:31.332399 IP 45.145.155.4.31281 > comp3143Winter2025.ssh: Flags [.], ack 6492, win 325, length 0
20:41:31.332399 IP 45.145.155.4.31281 > comp3143Winter2025.ssh: Flags [.], ack 7952, win 325, length 0
20:41:31.332400 IP 45.145.155.4.31281 > comp3143Winter2025.ssh: Flags [.], ack 8964, win 318, length 0
20:41:31.358557 IP comp3143Winter2025.55814 > 67.207.67.2.domain: Flags [.], ack 419, win 501, options [nop,nop,TS val 1150009131 ecr 4170486607], length 0
20:41:31.415119 IP comp3143Winter2025.ssh > 45.145.155.4.31281: Flags [P.], seq 10860:13776, ack 1, win 501, length 2916
20:41:31.435429 IP 45.145.155.4.31281 > comp3143Winter2025.ssh: Flags [.], ack 9240, win 353, length 0
20:41:31.475557 IP 103.180.177.5.56368 > comp3143Winter2025.ssh: Flags [F.], seq 1, ack 52, win 501, options [nop,nop,TS val 2672113720 ecr 1172723091], length 0
20:41:31.477759 IP comp3143Winter2025.ssh > 103.180.177.5.56368: Flags [F.], seq 52, ack 2, win 501, options [nop,nop,TS val 1172723342 ecr 2672113720], length 0
20:41:31.507650 IP 116.110.71.138.38062 > comp3143Winter2025.ssh: Flags [.], ack 53, win 501, options [nop,nop,TS val 2037059170 ecr 669081367], length 0
20:41:31.518835 IP comp3143Winter2025.ssh > 45.145.155.4.31281: Flags [P.], seq 13776:14524, ack 1, win 501, length 748
20:41:31.542582 IP 45.145.155.4.31281 > comp3143Winter2025.ssh: Flags [.], ack 9396, win 376, length 0
20:41:31.546764 IP 45.145.155.4.31281 > comp3143Winter2025.ssh: Flags [.], ack 10144, win 399, length 0
20:41:31.549908 IP 45.145.155.4.31281 > comp3143Winter2025.ssh: Flags [.], ack 10860, win 422, length 0
20:41:31.552213 IP 67.207.67.2.domain > comp3143Winter2025.37966: 30490 0/0/1 (56)
20:41:31.622771 IP comp3143Winter2025.ssh > 45.145.155.4.31281: Flags [P.], seq 14524:15080, ack 1, win 501, length 556
20:41:31.643268 IP 45.145.155.4.31281 > comp3143Winter2025.ssh: Flags [.], ack 12320, win 444, length 0
20:41:31.643268 IP 45.145.155.4.31281 > comp3143Winter2025.ssh: Flags [.], ack 13776, win 467, length 0
20:41:31.725841 IP 103.180.177.5.56368 > comp3143Winter2025.ssh: Flags [.], ack 53, win 501, options [nop,nop,TS val 2672113970 ecr 1172723342], length 0
20:41:31.726789 IP comp3143Winter2025.ssh > 45.145.155.4.31281: Flags [P.], seq 15080:15604, ack 1, win 501, length 524
20:41:31.747167 IP 45.145.155.4.31281 > comp3143Winter2025.ssh: Flags [.], ack 14524, win 490, length 0
20:41:31.796935 IP 67.207.67.2.domain > comp3143Winter2025.44998: 6916 0/0/1 (56)
20:41:31.830823 IP comp3143Winter2025.ssh > 45.145.155.4.31281: Flags [P.], seq 15604:15952, ack 1, win 501, length 348
20:41:31.851609 IP 45.145.155.4.31281 > comp3143Winter2025.ssh: Flags [.], ack 15080, win 513, length 0
20:41:31.934774 IP comp3143Winter2025.ssh > 45.145.155.4.31281: Flags [P.], seq 15952:16212, ack 1, win 501, length 260
20:41:31.954935 IP 45.145.155.4.31281 > comp3143Winter2025.ssh: Flags [.], ack 15604, win 536, length 0
20:41:32.038757 IP comp3143Winter2025.ssh > 45.145.155.4.31281: Flags [P.], seq 16212:16472, ack 1, win 501, length 260
20:41:32.063115 IP 45.145.155.4.31281 > comp3143Winter2025.ssh: Flags [.], ack 15952, win 559, length 0
20:41:32.142784 IP comp3143Winter2025.ssh > 45.145.155.4.31281: Flags [P.], seq 16472:16732, ack 1, win 501, length 260
20:41:32.167206 IP 45.145.155.4.31281 > comp3143Winter2025.ssh: Flags [.], ack 16212, win 581, length 0
20:41:32.246754 IP comp3143Winter2025.ssh > 45.145.155.4.31281: Flags [P.], seq 16732:16992, ack 1, win 501, length 260
20:41:32.267125 IP 45.145.155.4.31281 > comp3143Winter2025.ssh: Flags [.], ack 16472, win 604, length 0
20:41:32.294820 IP 218.92.0.156.32812 > comp3143Winter2025.ssh: Flags [S], seq 1216203447, win 29200, options [mss 1460,sackOK,TS val 1411228156 ecr 0,nop,wscale 7], length 0
20:41:32.294928 IP comp3143Winter2025.ssh > 218.92.0.156.32812: Flags [S.], seq 1526835646, ack 1216203448, win 65160, options [mss 1460,sackOK,TS val 2702430400 ecr 1411228156,nop,wscale 7], length 0
20:41:32.310553 IP comp3143Winter2025.ssh > 218.92.0.156.44507: Flags [S.], seq 761552027, ack 542683371, win 65160, options [mss 1460,sackOK,TS val 2702430416 ecr 1411226905,nop,wscale 7], length 0
20:41:32.351131 IP comp3143Winter2025.ssh > 45.145.155.4.31281: Flags [P.], seq 16992:17252, ack 1, win 501, length 260
20:41:32.351486 IP comp3143Winter2025.54700 > 67.207.67.2.domain: 19314+ [1au] PTR? 156.0.92.218.in-addr.arpa. (54)
20:41:32.351597 IP comp3143Winter2025.34575 > 67.207.67.2.domain: 27835+ [1au] PTR? 156.0.92.218.in-addr.arpa. (54)
20:41:32.351640 IP comp3143Winter2025.55814 > 67.207.67.2.domain: Flags [P.], seq 189:234, ack 419, win 501, options [nop,nop,TS val 1150010124 ecr 4170486607], length 45 16213+ PTR? 156.0.92.218.in-addr.arpa. (43)
20:41:32.352524 IP 67.207.67.2.domain > comp3143Winter2025.54700: 19314 NXDomain 0/1/1 (103)
20:41:32.352669 IP 67.207.67.2.domain > comp3143Winter2025.34575: 27835 NXDomain 0/1/1 (103)
20:41:32.352829 IP comp3143Winter2025.54700 > 67.207.67.2.domain: 19314+ PTR? 156.0.92.218.in-addr.arpa. (43)
20:41:32.352887 IP comp3143Winter2025.34575 > 67.207.67.2.domain: 27835+ PTR? 156.0.92.218.in-addr.arpa. (43)
20:41:32.353018 IP 67.207.67.2.domain > comp3143Winter2025.55814: Flags [P.], seq 419:513, ack 234, win 128, options [nop,nop,TS val 4170487642 ecr 1150010124], length 94 16213 NXDomain 0/1/0 (92)
20:41:32.353044 IP comp3143Winter2025.55814 > 67.207.67.2.domain: Flags [.], ack 513, win 501, options [nop,nop,TS val 1150010125 ecr 4170487642], length 0
20:41:32.353811 IP 67.207.67.2.domain > comp3143Winter2025.54700: 19314 NXDomain 0/1/0 (92)
20:41:32.353863 IP 67.207.67.2.domain > comp3143Winter2025.34575: 27835 NXDomain 0/1/0 (92)
20:41:32.354322 IP comp3143Winter2025.ssh > 45.145.155.4.31281: Flags [P.], seq 17252:17864, ack 1, win 501, length 612
20:41:32.370869 IP 45.145.155.4.31281 > comp3143Winter2025.ssh: Flags [.], ack 16732, win 627, length 0
20:41:32.454913 IP comp3143Winter2025.ssh > 45.145.155.4.31281: Flags [P.], seq 17864:19652, ack 1, win 501, length 1788
20:41:32.474896 IP 45.145.155.4.31281 > comp3143Winter2025.ssh: Flags [.], ack 16992, win 650, length 0
20:41:32.502574 IP 218.92.0.156.32812 > comp3143Winter2025.ssh: Flags [.], ack 1, win 229, options [nop,nop,TS val 1411228208 ecr 2702430400], length 0
20:41:32.502575 IP 218.92.0.156.32812 > comp3143Winter2025.ssh: Flags [P.], seq 1:16, ack 1, win 229, options [nop,nop,TS val 1411228208 ecr 2702430400], length 15: SSH: SSH-2.0-PUTTY
20:41:32.502675 IP comp3143Winter2025.ssh > 218.92.0.156.32812: Flags [.], ack 16, win 509, options [nop,nop,TS val 2702430608 ecr 1411228208], length 0
20:41:32.514073 IP comp3143Winter2025.ssh > 218.92.0.156.32812: Flags [P.], seq 1:43, ack 16, win 509, options [nop,nop,TS val 2702430619 ecr 1411228208], length 42: SSH: SSH-2.0-OpenSSH_8.9p1 Ubuntu-3ubuntu0.10
20:41:32.558830 IP comp3143Winter2025.ssh > 45.145.155.4.31281: Flags [P.], seq 19652:20624, ack 1, win 501, length 972
20:41:32.580684 IP 45.145.155.4.31281 > comp3143Winter2025.ssh: Flags [.], ack 17252, win 673, length 0
20:41:32.583164 IP 45.145.155.4.31281 > comp3143Winter2025.ssh: Flags [.], ack 17864, win 695, length 0
20:41:32.662793 IP comp3143Winter2025.ssh > 45.145.155.4.31281: Flags [P.], seq 20624:20996, ack 1, win 501, length 372
20:41:32.683184 IP 45.145.155.4.31281 > comp3143Winter2025.ssh: Flags [.], ack 19324, win 718, length 0
20:41:32.683184 IP 45.145.155.4.31281 > comp3143Winter2025.ssh: Flags [.], ack 19652, win 741, length 0
20:41:32.721736 IP 218.92.0.156.32812 > comp3143Winter2025.ssh: Flags [.], ack 43, win 229, options [nop,nop,TS val 1411228263 ecr 2702430619], length 0
20:41:32.721736 IP 218.92.0.156.32812 > comp3143Winter2025.ssh: Flags [P.], seq 16:872, ack 43, win 229, options [nop,nop,TS val 1411228263 ecr 2702430619], length 856
20:41:32.721807 IP comp3143Winter2025.ssh > 218.92.0.156.32812: Flags [P.], seq 43:1155, ack 16, win 509, options [nop,nop,TS val 2702430827 ecr 1411228263], length 1112
20:41:32.762522 IP comp3143Winter2025.ssh > 218.92.0.156.32812: Flags [.], ack 872, win 503, options [nop,nop,TS val 2702430868 ecr 1411228263], length 0
20:41:32.766792 IP comp3143Winter2025.ssh > 45.145.155.4.31281: Flags [P.], seq 20996:22016, ack 1, win 501, length 1020
20:41:32.787270 IP 45.145.155.4.31281 > comp3143Winter2025.ssh: Flags [.], ack 20624, win 764, length 0
20:41:32.870761 IP comp3143Winter2025.ssh > 45.145.155.4.31281: Flags [P.], seq 22016:22284, ack 1, win 501, length 268
20:41:32.891340 IP 45.145.155.4.31281 > comp3143Winter2025.ssh: Flags [.], ack 20996, win 787, length 0
20:41:32.966398 IP 45.142.193.106.52624 > comp3143Winter2025.1049: Flags [S], seq 976122002, win 1024, length 0
20:41:32.967718 IP 218.92.0.156.32812 > comp3143Winter2025.ssh: Flags [.], ack 1155, win 246, options [nop,nop,TS val 1411228325 ecr 2702430827], length 0
20:41:32.970130 IP 218.92.0.156.32812 > comp3143Winter2025.ssh: Flags [P.], seq 872:952, ack 1155, win 246, options [nop,nop,TS val 1411228325 ecr 2702430868], length 80
20:41:32.970200 IP comp3143Winter2025.ssh > 218.92.0.156.32812: Flags [.], ack 952, win 503, options [nop,nop,TS val 2702431075 ecr 1411228325], length 0
20:41:32.971868 IP comp3143Winter2025.ssh > 218.92.0.156.32812: Flags [P.], seq 1155:1467, ack 952, win 503, options [nop,nop,TS val 2702431077 ecr 1411228325], length 312
20:41:32.974761 IP comp3143Winter2025.ssh > 45.145.155.4.31281: Flags [P.], seq 22284:23312, ack 1, win 501, length 1028
20:41:32.995188 IP 45.145.155.4.31281 > comp3143Winter2025.ssh: Flags [.], ack 22016, win 809, length 0
20:41:33.077181 IP 116.110.71.138.38062 > comp3143Winter2025.ssh: Flags [P.], seq 96:132, ack 53, win 501, options [nop,nop,TS val 2037060742 ecr 669081367], length 36
20:41:33.077609 IP 116.110.71.138.38062 > comp3143Winter2025.ssh: Flags [P.], seq 132:208, ack 53, win 501, options [nop,nop,TS val 2037060742 ecr 669081367], length 76
20:41:33.077671 IP comp3143Winter2025.ssh > 116.110.71.138.38062: Flags [.], ack 208, win 501, options [nop,nop,TS val 669083191 ecr 2037060742], length 0
20:41:33.078777 IP comp3143Winter2025.ssh > 45.145.155.4.31281: Flags [P.], seq 23312:24068, ack 1, win 501, length 756
20:41:33.100243 IP 45.145.155.4.31281 > comp3143Winter2025.ssh: Flags [.], ack 22284, win 832, length 0
20:41:33.179480 IP 218.92.0.156.32812 > comp3143Winter2025.ssh: Flags [.], ack 1467, win 263, options [nop,nop,TS val 1411228377 ecr 2702431077], length 0
20:41:33.180916 IP 218.92.0.156.32812 > comp3143Winter2025.ssh: Flags [P.], seq 952:968, ack 1467, win 263, options [nop,nop,TS val 1411228378 ecr 2702431077], length 16
20:41:33.182748 IP comp3143Winter2025.ssh > 45.145.155.4.31281: Flags [P.], seq 24068:24656, ack 1, win 501, length 588
20:41:33.207130 IP 45.145.155.4.31281 > comp3143Winter2025.ssh: Flags [.], ack 23312, win 855, length 0
20:41:33.222571 IP comp3143Winter2025.ssh > 218.92.0.156.32812: Flags [.], ack 968, win 503, options [nop,nop,TS val 2702431328 ecr 1411228378], length 0
20:41:33.286775 IP comp3143Winter2025.ssh > 45.145.155.4.31281: Flags [P.], seq 24656:25076, ack 1, win 501, length 420
20:41:33.307107 IP 45.145.155.4.31281 > comp3143Winter2025.ssh: Flags [.], ack 24068, win 878, length 0
20:41:33.390797 IP comp3143Winter2025.ssh > 45.145.155.4.31281: Flags [P.], seq 25076:25336, ack 1, win 501, length 260
20:41:33.411625 IP 45.145.155.4.31281 > comp3143Winter2025.ssh: Flags [.], ack 24656, win 901, length 0
20:41:33.430203 IP 218.92.0.156.32812 > comp3143Winter2025.ssh: Flags [P.], seq 968:1032, ack 1467, win 263, options [nop,nop,TS val 1411228440 ecr 2702431328], length 64
20:41:33.430267 IP comp3143Winter2025.ssh > 218.92.0.156.32812: Flags [.], ack 1032, win 503, options [nop,nop,TS val 2702431535 ecr 1411228440], length 0
20:41:33.430481 IP comp3143Winter2025.ssh > 218.92.0.156.32812: Flags [P.], seq 1467:1531, ack 1032, win 503, options [nop,nop,TS val 2702431535 ecr 1411228440], length 64
20:41:33.494806 IP comp3143Winter2025.ssh > 45.145.155.4.31281: Flags [P.], seq 25336:26100, ack 1, win 501, length 764
20:41:33.515146 IP 45.145.155.4.31281 > comp3143Winter2025.ssh: Flags [.], ack 25076, win 924, length 0
20:41:33.598793 IP comp3143Winter2025.ssh > 45.145.155.4.31281: Flags [P.], seq 26100:26360, ack 1, win 501, length 260
20:41:33.620484 IP 45.145.155.4.31281 > comp3143Winter2025.ssh: Flags [.], ack 25336, win 946, length 0
20:41:33.638109 IP 218.92.0.156.32812 > comp3143Winter2025.ssh: Flags [P.], seq 1032:1112, ack 1531, win 263, options [nop,nop,TS val 1411228492 ecr 2702431535], length 80
20:41:33.645172 IP comp3143Winter2025.ssh > 218.92.0.156.32812: Flags [P.], seq 1531:1611, ack 1112, win 503, options [nop,nop,TS val 2702431750 ecr 1411228492], length 80
20:41:33.702814 IP comp3143Winter2025.ssh > 45.145.155.4.31281: Flags [P.], seq 26360:26972, ack 1, win 501, length 612
20:41:33.723194 IP 45.145.155.4.31281 > comp3143Winter2025.ssh: Flags [.], ack 26100, win 969, length 0
20:41:33.806804 IP comp3143Winter2025.ssh > 45.145.155.4.31281: Flags [P.], seq 26972:27232, ack 1, win 501, length 260
20:41:33.827830 IP 45.145.155.4.31281 > comp3143Winter2025.ssh: Flags [.], ack 26360, win 992, length 0
20:41:33.852939 IP 218.92.0.156.32812 > comp3143Winter2025.ssh: Flags [P.], seq 1112:1224, ack 1611, win 263, options [nop,nop,TS val 1411228546 ecr 2702431750], length 112
20:41:33.894527 IP comp3143Winter2025.ssh > 218.92.0.156.32812: Flags [.], ack 1224, win 503, options [nop,nop,TS val 2702432000 ecr 1411228546], length 0
20:41:33.910913 IP comp3143Winter2025.ssh > 45.145.155.4.31281: Flags [P.], seq 27232:27828, ack 1, win 501, length 596
20:41:33.931038 IP 45.145.155.4.31281 > comp3143Winter2025.ssh: Flags [.], ack 26972, win 1015, length 0
20:41:34.014802 IP comp3143Winter2025.ssh > 45.145.155.4.31281: Flags [P.], seq 27828:28096, ack 1, win 501, length 268
20:41:34.035534 IP 45.145.155.4.31281 > comp3143Winter2025.ssh: Flags [.], ack 27232, win 1038, length 0
20:41:34.118780 IP comp3143Winter2025.ssh > 45.145.155.4.31281: Flags [P.], seq 28096:28364, ack 1, win 501, length 268
20:41:34.139322 IP 45.145.155.4.31281 > comp3143Winter2025.ssh: Flags [.], ack 27828, win 1060, length 0
20:41:34.222753 IP comp3143Winter2025.ssh > 45.145.155.4.31281: Flags [P.], seq 28364:28632, ack 1, win 501, length 268
20:41:34.247244 IP 45.145.155.4.31281 > comp3143Winter2025.ssh: Flags [.], ack 28096, win 1083, length 0
20:41:34.326830 IP comp3143Winter2025.ssh > 45.145.155.4.31281: Flags [P.], seq 28632:28900, ack 1, win 501, length 268
20:41:34.347249 IP 45.145.155.4.31281 > comp3143Winter2025.ssh: Flags [.], ack 28364, win 1106, length 0
20:41:34.430740 IP comp3143Winter2025.ssh > 45.145.155.4.31281: Flags [P.], seq 28900:29168, ack 1, win 501, length 268
20:41:34.450863 IP 45.145.155.4.31281 > comp3143Winter2025.ssh: Flags [.], ack 28632, win 1129, length 0
20:41:34.534822 IP comp3143Winter2025.ssh > 45.145.155.4.31281: Flags [P.], seq 29168:29436, ack 1, win 501, length 268
20:41:34.555562 IP 45.145.155.4.31281 > comp3143Winter2025.ssh: Flags [.], ack 28900, win 1152, length 0
20:41:34.638826 IP comp3143Winter2025.ssh > 45.145.155.4.31281: Flags [P.], seq 29436:29704, ack 1, win 501, length 268
20:41:34.646504 IP 45.142.193.106.52624 > comp3143Winter2025.32066: Flags [S], seq 931017326, win 1024, length 0
20:41:34.661401 IP 45.145.155.4.31281 > comp3143Winter2025.ssh: Flags [.], ack 29168, win 1174, length 0
20:41:34.742868 IP comp3143Winter2025.ssh > 45.145.155.4.31281: Flags [P.], seq 29704:30084, ack 1, win 501, length 380
20:41:34.764552 IP 45.145.155.4.31281 > comp3143Winter2025.ssh: Flags [.], ack 29436, win 1197, length 0
20:41:34.834772 IP comp3143Winter2025.ssh > 116.110.71.138.38062: Flags [P.], seq 53:105, ack 208, win 501, options [nop,nop,TS val 669084948 ecr 2037060742], length 52
20:41:34.846870 IP comp3143Winter2025.ssh > 45.145.155.4.31281: Flags [P.], seq 30084:30520, ack 1, win 501, length 436
20:41:34.867644 IP 45.145.155.4.31281 > comp3143Winter2025.ssh: Flags [.], ack 29704, win 1220, length 0
20:41:34.950802 IP comp3143Winter2025.ssh > 45.145.155.4.31281: Flags [P.], seq 30520:30788, ack 1, win 501, length 268
20:41:34.971146 IP 45.145.155.4.31281 > comp3143Winter2025.ssh: Flags [.], ack 30084, win 1243, length 0
20:41:35.022653 IP 67.207.67.2.domain > comp3143Winter2025.55814: Flags [F.], seq 513, ack 234, win 128, options [nop,nop,TS val 4170490312 ecr 1150010125], length 0
20:41:35.022832 IP comp3143Winter2025.55814 > 67.207.67.2.domain: Flags [F.], seq 234, ack 514, win 501, options [nop,nop,TS val 1150012795 ecr 4170490312], length 0
20:41:35.024075 IP 67.207.67.2.domain > comp3143Winter2025.55814: Flags [.], ack 235, win 128, options [nop,nop,TS val 4170490313 ecr 1150012795], length 0
20:41:35.054846 IP comp3143Winter2025.ssh > 45.145.155.4.31281: Flags [P.], seq 30788:31544, ack 1, win 501, length 756
20:41:35.075376 IP 45.145.155.4.31281 > comp3143Winter2025.ssh: Flags [.], ack 30520, win 1266, length 0
20:41:35.086247 IP 116.110.71.138.38062 > comp3143Winter2025.ssh: Flags [.], ack 105, win 501, options [nop,nop,TS val 2037062749 ecr 669084948], length 0
20:41:35.158905 IP comp3143Winter2025.ssh > 45.145.155.4.31281: Flags [P.], seq 31544:31964, ack 1, win 501, length 420
20:41:35.179555 IP 45.145.155.4.31281 > comp3143Winter2025.ssh: Flags [.], ack 30788, win 1289, length 0
20:41:35.262747 IP comp3143Winter2025.ssh > 45.145.155.4.31281: Flags [P.], seq 31964:32232, ack 1, win 501, length 268
20:41:35.287733 IP 45.145.155.4.31281 > comp3143Winter2025.ssh: Flags [.], ack 31544, win 1311, length 0
20:41:35.319179 IP 116.110.71.138.38062 > comp3143Winter2025.ssh: Flags [F.], seq 208, ack 105, win 501, options [nop,nop,TS val 2037062984 ecr 669084948], length 0
20:41:35.320765 IP comp3143Winter2025.ssh > 116.110.71.138.38062: Flags [F.], seq 105, ack 209, win 501, options [nop,nop,TS val 669085434 ecr 2037062984], length 0
20:41:35.366782 IP comp3143Winter2025.ssh > 45.145.155.4.31281: Flags [P.], seq 32232:32828, ack 1, win 501, length 596
20:41:35.387114 IP 45.145.155.4.31281 > comp3143Winter2025.ssh: Flags [.], ack 31964, win 1334, length 0
20:41:35.470774 IP comp3143Winter2025.ssh > 45.145.155.4.31281: Flags [P.], seq 32828:33096, ack 1, win 501, length 268
20:41:35.491326 IP 45.145.155.4.31281 > comp3143Winter2025.ssh: Flags [.], ack 32232, win 1357, length 0
20:41:35.568272 IP comp3143Winter2025.ssh > 218.92.0.156.32812: Flags [P.], seq 1611:1691, ack 1224, win 503, options [nop,nop,TS val 2702433673 ecr 1411228546], length 80
20:41:35.574762 IP comp3143Winter2025.ssh > 45.145.155.4.31281: Flags [P.], seq 33096:33532, ack 1, win 501, length 436
20:41:35.594930 IP 45.145.155.4.31281 > comp3143Winter2025.ssh: Flags [.], ack 32828, win 1380, length 0
20:41:35.606562 IP comp3143Winter2025.ssh > 116.110.71.138.36018: Flags [F.], seq 1063661327, ack 3393025855, win 501, options [nop,nop,TS val 669085720 ecr 2036999371], length 0
20:41:35.678818 IP comp3143Winter2025.ssh > 45.145.155.4.31281: Flags [P.], seq 33532:33976, ack 1, win 501, length 444
20:41:35.698939 IP 45.145.155.4.31281 > comp3143Winter2025.ssh: Flags [.], ack 33096, win 1403, length 0
20:41:35.776909 IP 218.92.0.156.32812 > comp3143Winter2025.ssh: Flags [P.], seq 1224:1320, ack 1691, win 263, options [nop,nop,TS val 1411229027 ecr 2702433673], length 96
20:41:35.776979 IP comp3143Winter2025.ssh > 218.92.0.156.32812: Flags [.], ack 1320, win 503, options [nop,nop,TS val 2702433882 ecr 1411229027], length 0
20:41:35.782948 IP comp3143Winter2025.ssh > 45.145.155.4.31281: Flags [P.], seq 33976:34572, ack 1, win 501, length 596
20:41:35.802840 IP 45.145.155.4.31281 > comp3143Winter2025.ssh: Flags [.], ack 33532, win 1425, length 0
20:41:35.835179 IP 45.145.155.4.31281 > comp3143Winter2025.ssh: Flags [P.], seq 1:37, ack 33532, win 1425, length 36
20:41:35.862557 IP comp3143Winter2025.ssh > 116.110.71.138.38062: Flags [F.], seq 105, ack 209, win 501, options [nop,nop,TS val 669085976 ecr 2037062984], length 0
20:41:35.878659 IP comp3143Winter2025.ssh > 45.145.155.4.31281: Flags [.], ack 37, win 501, length 0
20:41:35.886846 IP comp3143Winter2025.ssh > 45.145.155.4.31281: Flags [P.], seq 34572:35224, ack 37, win 501, length 652
20:41:35.911200 IP 45.145.155.4.31281 > comp3143Winter2025.ssh: Flags [.], ack 33976, win 1448, length 0
20:41:35.990762 IP comp3143Winter2025.ssh > 45.145.155.4.31281: Flags [P.], seq 35224:35492, ack 37, win 501, length 268
20:41:36.015150 IP 45.145.155.4.31281 > comp3143Winter2025.ssh: Flags [.], ack 34572, win 1471, length 0
20:41:36.094785 IP comp3143Winter2025.ssh > 45.145.155.4.31281: Flags [P.], seq 35492:35760, ack 37, win 501, length 268
20:41:36.116834 IP 45.145.155.4.31281 > comp3143Winter2025.ssh: Flags [.], ack 35224, win 1494, length 0
20:41:36.198769 IP comp3143Winter2025.ssh > 45.145.155.4.31281: Flags [P.], seq 35760:36028, ack 37, win 501, length 268
20:41:36.222860 IP 45.145.155.4.31281 > comp3143Winter2025.ssh: Flags [.], ack 35492, win 1517, length 0
20:41:36.303266 IP comp3143Winter2025.ssh > 45.145.155.4.31281: Flags [P.], seq 36028:36296, ack 37, win 501, length 268
20:41:36.325754 IP 45.145.155.4.31281 > comp3143Winter2025.ssh: Flags [.], ack 35760, win 1539, length 0
20:41:36.374587 IP comp3143Winter2025.ssh > 218.92.0.156.44507: Flags [S.], seq 761552027, ack 542683371, win 65160, options [mss 1460,sackOK,TS val 2702434480 ecr 1411226905,nop,wscale 7], length 0
20:41:36.406549 IP comp3143Winter2025.ssh > 116.110.71.138.38062: Flags [F.], seq 105, ack 209, win 501, options [nop,nop,TS val 669086520 ecr 2037062984], length 0
20:41:36.406833 IP comp3143Winter2025.ssh > 45.145.155.4.31281: Flags [P.], seq 36296:36924, ack 37, win 501, length 628
20:41:36.510799 IP comp3143Winter2025.ssh > 45.145.155.4.31281: Flags [P.], seq 36924:37080, ack 37, win 501, length 156
20:41:36.532304 IP 45.145.155.4.31281 > comp3143Winter2025.ssh: Flags [.], ack 35760, win 1539, options [nop,nop,sack 1 {36028:36296}], length 0
20:41:36.532372 IP comp3143Winter2025.ssh > 45.145.155.4.31281: Flags [P.], seq 35760:36028, ack 37, win 501, length 268
20:41:36.636115 IP 45.145.155.4.31281 > comp3143Winter2025.ssh: Flags [.], ack 35760, win 1562, options [nop,nop,sack 1 {36028:36924}], length 0
20:41:36.636182 IP comp3143Winter2025.ssh > 45.145.155.4.31281: Flags [P.], seq 37080:37508, ack 37, win 501, length 428
20:41:36.653659 IP 116.110.71.138.38062 > comp3143Winter2025.ssh: Flags [.], ack 106, win 501, options [nop,nop,TS val 2037064318 ecr 669086520], length 0
20:41:36.739786 IP 45.145.155.4.31281 > comp3143Winter2025.ssh: Flags [.], ack 35760, win 1562, options [nop,nop,sack 1 {36028:37080}], length 0
20:41:36.739879 IP comp3143Winter2025.ssh > 45.145.155.4.31281: Flags [P.], seq 37508:37968, ack 37, win 501, length 460
20:41:36.764367 IP 45.145.155.4.31281 > comp3143Winter2025.ssh: Flags [.], ack 37080, win 1562, length 0
20:41:36.822847 IP comp3143Winter2025.ssh > 45.145.155.4.31281: Flags [P.], seq 37968:38380, ack 37, win 501, length 412
20:41:36.867209 IP 45.145.155.4.31281 > comp3143Winter2025.ssh: Flags [.], ack 37508, win 1585, length 0
20:41:36.871754 IP 45.142.193.106.52624 > comp3143Winter2025.63922: Flags [S], seq 2606943814, win 1024, length 0
20:41:36.926772 IP comp3143Winter2025.ssh > 45.145.155.4.31281: Flags [P.], seq 38380:38760, ack 37, win 501, length 380
20:41:36.969762 IP 45.145.155.4.31281 > comp3143Winter2025.ssh: Flags [.], ack 37968, win 1608, length 0
20:41:37.030878 IP comp3143Winter2025.ssh > 45.145.155.4.31281: Flags [P.], seq 38760:39028, ack 37, win 501, length 268
20:41:37.053366 IP 45.145.155.4.31281 > comp3143Winter2025.ssh: Flags [.], ack 38380, win 1631, length 0
20:41:37.134820 IP comp3143Winter2025.ssh > 45.145.155.4.31281: Flags [P.], seq 39028:39296, ack 37, win 501, length 268
20:41:37.155156 IP 45.145.155.4.31281 > comp3143Winter2025.ssh: Flags [.], ack 38760, win 1654, length 0
20:41:37.238784 IP comp3143Winter2025.ssh > 45.145.155.4.31281: Flags [P.], seq 39296:39564, ack 37, win 501, length 268
20:41:37.259184 IP 45.145.155.4.31281 > comp3143Winter2025.ssh: Flags [.], ack 39028, win 1654, length 0
20:41:37.342720 IP comp3143Winter2025.ssh > 45.145.155.4.31281: Flags [P.], seq 39564:39832, ack 37, win 501, length 268
20:41:37.363137 IP 45.145.155.4.31281 > comp3143Winter2025.ssh: Flags [.], ack 39296, win 1654, length 0
20:41:37.446790 IP comp3143Winter2025.ssh > 45.145.155.4.31281: Flags [P.], seq 39832:40100, ack 37, win 501, length 268
20:41:37.467070 IP 45.145.155.4.31281 > comp3143Winter2025.ssh: Flags [.], ack 39564, win 1654, length 0
20:41:37.550807 IP comp3143Winter2025.ssh > 45.145.155.4.31281: Flags [P.], seq 40100:40368, ack 37, win 501, length 268
20:41:37.571238 IP 45.145.155.4.31281 > comp3143Winter2025.ssh: Flags [.], ack 39832, win 1654, length 0
20:41:37.654761 IP comp3143Winter2025.ssh > 45.145.155.4.31281: Flags [P.], seq 40368:40636, ack 37, win 501, length 268
20:41:37.675233 IP 45.145.155.4.31281 > comp3143Winter2025.ssh: Flags [.], ack 40100, win 1654, length 0
20:41:37.758749 IP comp3143Winter2025.ssh > 45.145.155.4.31281: Flags [P.], seq 40636:40904, ack 37, win 501, length 268
20:41:37.779133 IP 45.145.155.4.31281 > comp3143Winter2025.ssh: Flags [.], ack 40368, win 1654, length 0
20:41:37.862742 IP comp3143Winter2025.ssh > 45.145.155.4.31281: Flags [P.], seq 40904:41172, ack 37, win 501, length 268
20:41:37.883321 IP 45.145.155.4.31281 > comp3143Winter2025.ssh: Flags [.], ack 40636, win 1654, length 0
20:41:37.966801 IP comp3143Winter2025.ssh > 45.145.155.4.31281: Flags [P.], seq 41172:41440, ack 37, win 501, length 268
20:41:37.986904 IP 45.145.155.4.31281 > comp3143Winter2025.ssh: Flags [.], ack 40904, win 1654, length 0
20:41:38.070762 IP comp3143Winter2025.ssh > 45.145.155.4.31281: Flags [P.], seq 41440:41708, ack 37, win 501, length 268
20:41:38.091940 IP 45.145.155.4.31281 > comp3143Winter2025.ssh: Flags [.], ack 41172, win 1654, length 0
20:41:38.174852 IP comp3143Winter2025.ssh > 45.145.155.4.31281: Flags [P.], seq 41708:41976, ack 37, win 501, length 268
20:41:38.196687 IP 45.145.155.4.31281 > comp3143Winter2025.ssh: Flags [.], ack 41440, win 1654, length 0
20:41:38.278780 IP comp3143Winter2025.ssh > 45.145.155.4.31281: Flags [P.], seq 41976:42244, ack 37, win 501, length 268
20:41:38.300293 IP 45.145.155.4.31281 > comp3143Winter2025.ssh: Flags [.], ack 41708, win 1654, length 0
20:41:38.382770 IP comp3143Winter2025.ssh > 45.145.155.4.31281: Flags [P.], seq 42244:42512, ack 37, win 501, length 268
20:41:38.404050 IP 45.145.155.4.31281 > comp3143Winter2025.ssh: Flags [.], ack 41976, win 1654, length 0
20:41:38.486768 IP comp3143Winter2025.ssh > 45.145.155.4.31281: Flags [P.], seq 42512:42780, ack 37, win 501, length 268
20:41:38.509289 IP 45.145.155.4.31281 > comp3143Winter2025.ssh: Flags [.], ack 42244, win 1654, length 0
20:41:38.590809 IP comp3143Winter2025.ssh > 45.145.155.4.31281: Flags [P.], seq 42780:43048, ack 37, win 501, length 268
20:41:38.615474 IP 45.145.155.4.31281 > comp3143Winter2025.ssh: Flags [.], ack 42512, win 1654, length 0
20:41:38.694705 IP comp3143Winter2025.ssh > 45.145.155.4.31281: Flags [P.], seq 43048:43316, ack 37, win 501, length 268
20:41:38.716257 IP 45.145.155.4.31281 > comp3143Winter2025.ssh: Flags [.], ack 42780, win 1654, length 0
